Text,Schedule
"AI ethics is no longer a future discussion, but a present imperative. Let's build responsible AI by prioritizing transparency & fairness in algorithms. The future depends on it. #AIethics #ResponsibleAI","2025-03-29T03:42:06.068Z"
"AI's increasing role in code generation is exciting, but remember: human oversight & testing are *crucial*. Don't blindly trust the machine! Quality code still needs a human touch. #AI #MachineLearning","2025-03-29T06:45:27.883Z"
"AI's potential is immense, but ethical frameworks must evolve alongside its capabilities. Algorithmic bias is a real threat, demanding transparency and accountability. Let's build responsibly. #AIethics #ResponsibleAI","2025-03-29T10:49:19.753Z"
"AI is rapidly automating repetitive tasks. How can we proactively adapt our skillsets for a future where creativity & critical thinking are paramount? #AI #FutureofWork","2025-03-29T13:51:52.368Z"
"AI's rapid evolution demands ethical frameworks *now*. Building responsible algorithms & transparent datasets is crucial for a future we can trust. What role will you play? #AIethics #ResponsibleAI","2025-03-29T02:53:58.423Z"
"AI isn't magic; it's math & massive datasets. Understanding the underlying algorithms is crucial for responsible development & deployment. Don't just blindly trust! #AIethics #MachineLearning","2025-03-29T10:55:41.147Z"
"AI is rapidly transforming industries, but ethical considerations must be front and center. Bias in algorithms can perpetuate inequalities. Let's build a more equitable future with responsible tech. #AIethics #TechForGood","2025-03-29T11:10:37.144Z"
"Node.js thrives in India's fintech surge! Its non-blocking I/O excels at handling the massive scale of UPI transactions & powering the real-time apps driving #DigitalIndia. A key enabler for seamless digital payments. #Nodejs","2025-03-30T12:31:39.381Z"
"Wow, just read about the massive cloud infrastructure investments happening across India! 🇮🇳 It's incredible seeing the scale-up. Personally, I think hybrid cloud is where the real action is for many enterprises here. 🤔 What's your take on the #CloudIndia boom & current trends? Share your thoughts! #HybridCloud","2025-03-30T09:34:22.093Z"
